{
  "schema_version": "1.0",
  "run_id": "pilot.ru.mysticism-article:1",
  "task_id": "pilot.ru.mysticism-article",
  "task_revision": "1",
  "spec_revision": "0.2.0-draft",
  "registry_revision": "sha256:d1892cffc009aa84d64be2128707613b1985f1030d179420622b917cb285a519",
  "state": "ready",
  "blocked_stage": null,
  "task": {
    "subject": "Недосказанность как основной механизм мистической истории",
    "central_question": "Почему ограниченная и последовательная неизвестность может делать мистическую историю сильнее прямого объяснения?",
    "reader_promise": "Читатель поймёт, из каких элементов складывается работающая мистическая недосказанность и где тайна превращается в пустую туманность.",
    "primary_job": "critical-analysis",
    "artifact_form": "article",
    "resolved_inputs": {
      "language": "ru",
      "locale": "ru-RU",
      "content_type": "article",
      "topic": "entertainment",
      "platform": "blog",
      "skill": null,
      "tone": "friendly",
      "audience": {
        "description": "Читатели общего блога, которым интересны мистика и устройство историй",
        "knowledge_level": "general",
        "needs": [
          "Понять, как недосказанность создаёт мистическое напряжение",
          "Отличить работающую тайну от произвольной туманности",
          "Увидеть, почему полное объяснение иногда ослабляет финал"
        ]
      },
      "intent": "Разобрать мистику как повествовательный механизм без утверждений о реальности сверхъестественного",
      "author_perspective": "editorial",
      "risk_level": "low",
      "visual_mode": "auto"
    },
    "constraints": [
      "Писать нативно на русском языке",
      "Не выдавать сверхъестественное за установленный факт",
      "Не ссылаться на вымышленные личные переживания",
      "Не использовать узнаваемых персонажей, бренды и реальные места",
      "Держать source notes и review вне публичной статьи"
    ],
    "required_disclosures": []
  },
  "resolution": {
    "spec_revision": "0.2.0-draft",
    "registry_revision": "sha256:d1892cffc009aa84d64be2128707613b1985f1030d179420622b917cb285a519",
    "inputs": {
      "language": "ru",
      "locale": "ru-RU",
      "content_type": "article",
      "topic": "entertainment",
      "platform": "blog",
      "skill": null,
      "tone": "friendly",
      "audience": {
        "description": "Читатели общего блога, которым интересны мистика и устройство историй",
        "knowledge_level": "general",
        "needs": [
          "Понять, как недосказанность создаёт мистическое напряжение",
          "Отличить работающую тайну от произвольной туманности",
          "Увидеть, почему полное объяснение иногда ослабляет финал"
        ]
      },
      "intent": "Разобрать мистику как повествовательный механизм без утверждений о реальности сверхъестественного",
      "author_perspective": "editorial",
      "risk_level": "low",
      "visual_mode": "auto"
    },
    "origins": {
      "language": "config",
      "locale": "config",
      "content_type": "config",
      "topic": "config",
      "platform": "config",
      "skill": "omitted",
      "tone": "config",
      "audience": "config",
      "intent": "config",
      "author_perspective": "config",
      "risk_level": "config",
      "visual_mode": "config"
    },
    "root_objects": [
      "core.writing-pipeline",
      "core.content-model",
      "core.context-selection",
      "rule.source-integrity",
      "rule.human-signals.core",
      "reviewer.source",
      "reviewer.language",
      "reviewer.human-signals",
      "reviewer.editor",
      "language.ru.foundation",
      "format.article.foundation",
      "reviewer.format",
      "topic.entertainment.foundation",
      "reviewer.topic",
      "platform.blog.foundation",
      "reviewer.platform",
      "tone.friendly",
      "rule.visual-integrity",
      "reviewer.visual"
    ],
    "dependency_order": [
      "core.content-model",
      "core.context-selection",
      "principle.audience-before-format",
      "principle.facts-before-fluency",
      "principle.meaning-before-engagement",
      "principle.native-not-translated",
      "principle.revision-with-purpose",
      "core.writing-pipeline",
      "rule.source-integrity",
      "rule.human-signals.prohibited-practices",
      "rule.human-signals.core",
      "reviewer.source",
      "reviewer.language",
      "reviewer.human-signals",
      "reviewer.editor",
      "language.ru.foundation",
      "rule.style.no-template-pressure",
      "format.article.foundation",
      "reviewer.format",
      "topic.general.foundation",
      "topic.entertainment.foundation",
      "reviewer.topic",
      "platform.blog.foundation",
      "reviewer.platform",
      "tone.friendly",
      "rule.visual-integrity",
      "reviewer.visual"
    ],
    "fallbacks": [],
    "inferences": [],
    "conflicts": [],
    "warnings": []
  },
  "sources": [
    {
      "id": "SRC-001",
      "title": "Entertainment Topic Foundation",
      "role": "Правила критического анализа жанрового материала",
      "location": "rules/topic/entertainment/foundation.md",
      "version": "repository revision",
      "status": "draft runtime module",
      "scope": "Разделение наблюдения, интерпретации, критерия и ограниченного суждения",
      "rights": "repository license"
    },
    {
      "id": "SRC-002",
      "title": "Article Format Foundation",
      "role": "Структура и критерии завершённости статьи",
      "location": "rules/format/article/foundation.md",
      "version": "repository revision",
      "status": "draft runtime module",
      "scope": "Проектирование и редактирование длинной формы",
      "rights": "repository license"
    },
    {
      "id": "SRC-003",
      "title": "Visual and Illustration Integrity",
      "role": "Границы оригинальной редакционной иллюстрации",
      "location": "rules/visual/illustration-integrity.md",
      "version": "repository revision",
      "status": "draft runtime module",
      "scope": "Недокументальный визуал, права, alt text и provenance",
      "rights": "repository license"
    }
  ],
  "claim_ledger": [
    {
      "id": "C-001",
      "text": "В рамках выбранного критерия мистическая недосказанность работает, когда история оставляет несколько возможных объяснений, но сохраняет устойчивые последствия и ограничения.",
      "classification": "inference",
      "material": true,
      "source_ids": [
        "SRC-001",
        "SRC-002"
      ],
      "qualification": "Это редакционная интерпретация механики повествования, а не универсальный психологический закон.",
      "disposition": "use"
    },
    {
      "id": "C-002",
      "text": "Конкретный след события может поддерживать мистическое напряжение лучше, чем дополнительное объяснение, если сам след не доказывает единственную причину.",
      "classification": "inference",
      "material": true,
      "source_ids": [
        "SRC-001"
      ],
      "qualification": "Вывод ограничен анализом повествовательной формы и не описывает измеренную реакцию всех читателей.",
      "disposition": "use"
    },
    {
      "id": "C-003",
      "text": "Полное объяснение в финале может ослабить мистическую историю, когда оно заменяет пространство интерпретации одной буквальной инструкцией.",
      "classification": "opinion",
      "material": true,
      "source_ids": [
        "SRC-001",
        "SRC-002"
      ],
      "qualification": "Это заявленный редакционный критерий, а не обязательное правило для каждого произведения.",
      "disposition": "use"
    },
    {
      "id": "C-004",
      "text": "Неоднозначные финалы всегда пугают любого читателя сильнее однозначных.",
      "classification": "unknown",
      "material": false,
      "source_ids": [],
      "qualification": "Универсальное утверждение не подтверждено и не требуется для тезиса статьи.",
      "disposition": "omit"
    }
  ],
  "gates": {
    "framing": {
      "status": "pass"
    },
    "module_resolution": {
      "status": "pass"
    },
    "context": {
      "gate": "context-gate",
      "status": "pass",
      "blockers": [],
      "checked_claims": 4,
      "checked_sources": 3
    },
    "media": {
      "mode": "auto",
      "decision": "selected",
      "status": "ready",
      "reason": "Атмосферная обложка визуально показывает границу между видимым следом и неизвестной причиной, не добавляя фактов.",
      "brief": {
        "purpose": "Создать редакционную рамку для статьи о недосказанности: показать видимый след и скрытую причину.",
        "reader_benefit": "Обложка настраивает на тему неизвестности, не изображая конкретное сверхъестественное существо.",
        "evidence_basis": "Тезисы C-001 и C-002 и правило визуальной целостности.",
        "must_not_imply": [
          "что изображено реальное место",
          "что сверхъестественное событие документально подтверждено",
          "что за дверью находится конкретное существо",
          "что иллюстрация относится к существующему фильму, книге или игре"
        ],
        "asset_type": "оригинальная атмосферная редакционная обложка",
        "acceptance_criteria": [
          "в кадре нет людей, персонажей, логотипов и текста",
          "источник тревоги остаётся неоднозначным",
          "визуал не выглядит документальной фотографией",
          "композиция пригодна для широкого заголовочного изображения",
          "caption и alt text обозначают концептуальный характер изображения"
        ]
      },
      "findings": []
    }
  },
  "content_design": {
    "status": "ready",
    "design_revision": "mysticism-design-1",
    "reader_promise": "Читатель поймёт, из каких элементов складывается работающая мистическая недосказанность и где тайна превращается в пустую туманность.",